"Review","annotation_id","annotator","created_at","id","lead_time","sentiment","updated_at""Муж купил за замену Samsung galaxy s4 mini из-за слабой батареи, ну уж больно быстро разряжалась. Новинка, характеристики отличные, но на деле...Процессор у сони стоит мощней, но по быстродействию уступает самсунгу. Я привыкла, что все открывается моментально, а тут с задержкой и это меня начинает раздражать((..Камера ужас ужасный, видео - даже и представить не могла, что такое качество может быть на современном телефоне...Зато 4 g есть, хотя лично мне на него как-то....И 3g вполне устраивал и ничего не тормозило. Так что не знаю даже....Обычный аппарат. Пользуюсь меньше месяца и особого восторга нет как-то. Когда самсунг заменит батареи непременно поменяю данный телефон).",53,"1","2024-05-27T17:50:02.549101Z",88,11.811,"neutral","2024-05-27T17:50:02.549101Z"
"сравниваю с Samsung Galaxy Star Plus GT-S7262(опыт исп. год).в первый же день использования 318 выявил, что при просмотре контактов не видно где они сохранены(сим 1 или сим 2 или телефон). нужно открыть контакт и тогда будет видно расположение.допустим случайно сохранил номер не туда и забыл перенести. сел телефон. достал сим и поставил в другой телефон. и хрен. ну а когда расположение контактов на виду, больше шансов вовремя заметить и перенести номер куда надо. можно конечно копировать на все сим и телефон одни и те же номера(так и придется делать), но на хрен делать лишние телодвижения так же как и проверять по отдельности место сохранения номеров. может быть есть сторонние приложения, которые решат это неудобство?не всегда с первого раза можно дозвониться на сим 2.(как буд-то не доступен)
на 7262, хоть и медленный, таких проблем не наблюдалось(да и при разговоре слышно хуже в обе стороны, чем 318)правда не обновлял п о. может что-то наладится",54,"1","2024-05-27T17:50:18.752221Z",89,13.996,"negative","2024-05-27T17:50:18.752221Z"
"2 Гб памяти забиваются влёт приложениями. Поудалял всё. В принципе телефон хорош, после Xperia Ray не привычно конечно... основные кнопки сенсорные.",55,"1","2024-05-27T17:50:29.982591Z",90,8.991,"positive","2024-05-27T17:50:29.982591Z"
"Модель отличная.Доволен очень.В качественных наушниках музыку слушать одно удовольствие.Звук отличный.Не тормозит вообще.Очень шустрый.Камера качественная,но желательно редактировать фото после снимка в помещении фоторедактором, для полноценных цветов.Аккумулятора хватает на день при активном пользовании интернета.Игрухи тянет все.Lenovo последнее время радует меня.Дешевле в цене,по отношению с другими известными брендами,типа Самсунга и т.д...Советую брать!!!!",56,"1","2024-05-27T17:50:40.933453Z",91,6.33,"positive","2024-05-27T17:50:40.933453Z"
"Хороший телефон, но не за эти деньги. LG в плане эргономики считаю на более высоком уровне. Продал -  и не жалею.Аппарат для фанатов. Плюсы/минусы описал в сравнении с LG 4Gc, коим долго пользовался. Так вот - ""лыжа"" - для работы и отдыха, сони - больше для имиджа. Разница в цене в 2 раза, а сверхплюсов у соньки не нашёл.",57,"1","2024-05-27T17:50:51.932155Z",92,8.912,"negative","2024-05-27T17:50:51.932155Z"
"У самого был Galaxy s3, он мне очень нравился, но на спорт площадке я его выронил, он сильно пострадал. А вообще у меня самым первым смартфоном был LG p500, присмотрелся к G2, современная начинка, вот и купил. Пользуюсь еще недолго, к оболочке интерфейса уже привык, ничем не хуже галактики. В G2 радует большая емкость акумулятора, мне на 2 дня с запасом хватает. Радует то что цена адекватней конкурентов, тот же пластиковый s4 стоит на 5-10 тыс. дороже. про айфоны и говорить не буду сколько люди за него переплачивают.",58,"1","2024-05-27T17:51:04.439193Z",93,10.424,"positive","2024-05-27T17:51:04.439193Z"
"Продукты этой фирмы фиг когда больше куплю.",59,"1","2024-05-27T17:51:34.270912Z",94,6.804,"negative","2024-05-27T17:51:34.270912Z"
"за такую цену аппарат, очень хорош, все устраивает, аккумулятор держит хорошо даже при активном пользовании интернетом и частыми звонками. В игры особо не играю, так что про них говорить ничего не буду. Аппарат очень нравится",60,"1","2024-05-27T17:51:40.841041Z",95,4.58,"positive","2024-05-27T17:51:40.841041Z"
"Покупкой довольна. Удобный. Быстрый. Разочаровал звук (музыку не слушаю, просто качество мелодий на звонке не нравится).",61,"1","2024-05-27T17:51:46.843501Z",96,4.123,"positive","2024-05-27T17:51:46.843501Z"
"отличный смартфон, до сих пор не вижу необходимости его менять, правда, была бы стабильная прошивка был бы очень рад.",62,"1","2024-05-27T17:51:53.872496Z",97,4.774,"positive","2024-05-27T17:51:53.872496Z"
"Про фронт.камеру писать не буду/это осознанный выбор.
Время покажет был ли я прав в выборе данного девайса.
Покупал за 32990 в белом цвете.",63,"1","2024-05-27T17:52:06.974425Z",98,9.756,"neutral","2024-05-27T17:52:06.974425Z"
"Давно заказав данный аппарат в магазине, все это время сомневался, начитавшись некоторых отзывов счастливых первообладателей. Но, либо я везунчик, либо ""обладатели"" преувеличивают свое обладание, аппарат никак не проявляет недоработок или ошибок. Работает ровно, без глюков.
Перед этим смартфоном были Sony Z5 и Galaxy Note 4.",64,"1","2024-05-27T17:52:16.912790Z",99,7.833,"neutral","2024-05-27T17:52:16.912790Z"
"Пользуюсь больше года и до сих пор он меня только радует. Первый мой телефон в котором я ничего не хочу исправлять. Обычно рут, прошивки и тд. Здесь же всем доволен. Камера хорошая, а в про режиме просто огонь. Компактный, не люблю лопаты. По автономности сеачала были вопросы, но с обновлением на орео стало просто отлично. За день с 5 часов экрана увеличилось до 7. Аж не верилось",65,"1","2024-05-27T17:52:25.244114Z",100,5.026,"positive","2024-05-27T17:52:25.244114Z"
"В свое время был неплохой моделью.",66,"1","2024-05-27T17:52:33.461231Z",101,6.145,"neutral","2024-05-27T17:52:33.461231Z"
"Покупала 1.5 года назад за 6500, т.е не дешево для такой глючной модели. У меня до этого тоже был Fly другой, более старой, модели в 2 раза дешевле, но совершенно лишенный таких глюков, только камера там не очень была, но пользовалась бы до сих пор, если бы не упала на него очень неудачно.",67,"1","2024-05-27T17:52:44.583466Z",102,8.706,"positive","2024-05-27T17:52:44.583466Z"
"В целом, гаджет оставляет только положительные эмоции. Тут самое мощное железо, самый крутой дисплей, великолепная 13мп камера с оптической оптимизацией это все для меня любимого и лучше любого моего прошлого телефона.",68,"1","2024-05-27T17:52:52.496400Z",103,5.17,"positive","2024-05-27T17:52:52.496400Z"
