"Review","annotation_id","annotator","created_at","id","lead_time","sentiment","updated_at"
"Это мой первый опыт эксплуатации смартфона, раньше пользовалась обычным телефоном. По началу было сложновато, так как все по другому, потихонечку привыкла. Через недельку использования докупила чехол, так как задняя крышка совсем не устойчива к царапинам, однако внешний вид от данного приобретения ни как не пострадал, а скорее всего выиграл! Еще через неделю поняла, что надо расширить внутреннюю память, благо имеется слот для microSDкарты. Приобрела флешку на 32 ГБ - все стало совсем хорошо!). Очень понравилась функция центральной кнопки - она работает как индикатор, загорается разными цветами, в зависимости от пропущенного звонка, сообщения, будильника и т.д.(очччень удобно, особенно в ночное время)! Первое время искала, как включается подсветка нижних кнопок, так как не совсем удобно использовать их при плохом освещении, часто промахивалась), выяснила что никак(. Со временем к этому нюансу привыкла. В целом впечатления от аппарата очень хорошие, на четверку с плюсом! Не могу сказать, что он идеален, но мне, как новичку в использовании смартфона в самый раз, даже за глаза!:-). Все гармонично, пользуюсь активно интернетом, ничего не тормозит, приложений куча, выбирай - не хочу! Камера 8Мп вполне способна делать приличные снимки, да и аккумуляторная батарея в 2460мАч подстрахует, если что!). Ну и, конечно же, стоимость LG Optimus L7 II P713 по сравнению с другими моделям со схожими характеристиками явно выигрывает. Считаю, что данная модель подходит как для новичков, так и для продвинутых пользователей смартфонов! Хороший аппарат, советую всем!",23,"1","2024-05-27T17:44:18.842265Z",58,7.653,"positive","2024-05-27T17:44:18.842265Z"
"Увы, главную детскую болезнь за все время выпуска так и не вылечили. Очень жалко, чрезвычайно симпатичный и оригинальный аппарат.",24,"1","2024-05-27T17:44:31.161330Z",59,8.481,"negative","2024-05-27T17:44:31.161330Z"
"Не когда не писал отзыв, но сегодня он меня довел, может конечно много хочу, но он просто ужас. До этого был zte в том же диапазоне цены, но робил, а это чудо техники просто висит. На морозе кстати вырубается. Вообщем ни кому не советую!!!",25,"1","2024-05-27T17:44:44.437715Z",60,10.174,"negative","2024-05-27T17:44:44.437715Z"
"Некоторые отзывы на ЯМ не достойны внимания - обратите внимание, люди взяли на тест аппарат из рук производителя, и хвалят, поиграв сутки: спроси их, заплатили бы 12000 за это, что они скажут? Если мне дать поиграть колечко золотое за 100000 я тоже скажу, хорошее, но мне то зачем, не куплю? Такое ощущение, что довольные или переходят с мелких нокий на ВФ7, или сидели на тексетах и планшетах за 3000 из гипермаркета. Ощущения после асус фон педа за 10000, кстати, это далеко не элит класс, это дешевле люмии!, как будто мне дали китайскую подделку под телефон 2010 года. Вы покупаете платформу, которая проигрывает со счетом 1 к 33. Вы подписываетесь на не просто отстающего, вы делаете ставку на лошадь не просто пятую, а в тридцать три раза отстающую от лидера. Маргинальную. Кто еще думает, не покупайте, возьмите у друзей попробовать, только так. К сожалению, аппарат без брака, и его не вернуть. Впервые в жизни мечтаешь о том, чтобы обнаружился брак.

UPD через 2 месяца (продать не смог за 2/3 цены) вылезла проблема описанная на форумах - желтое пятно под часами, появляющееся просто при активности экрана через минуты, без всяких игр или нестандартных приложений. В сервис, надеюсь, экраны не меняют и всем подряд, и они есть.",26,"1","2024-05-27T17:44:53.683525Z",61,6.629,"neutral","2024-05-27T17:44:53.683525Z"
"в целом,покупкой довольна,берите,цена все маленькие недочеты покрывает!)))))",27,"1","2024-05-27T17:45:02.145406Z",62,24.413,"positive","2024-05-27T17:45:29.441202Z"
"Будучи преданным пользователем телефонов Nokia (и супер простого, и флагмана своего времени Nokia N97), решила свою отслужившую верную службу Lumia 520 заменить на что-нибудь более быстрое. Попробовала тест-драйв, т.к. выбирала между 640 и 640 XL. Результат в пользу меньшей модели, НО лишь из-за крупных габаритов (а вот мужчинам наоборот, рекомендую Luima 640 XL, т.к. по общим характеристикам она лучше).",28,"1","2024-05-27T17:45:21.133679Z",63,5.083,"neutral","2024-05-27T17:45:21.133679Z"
"В целом хорошо да и недорого всего лишь 4590, за такую цену смартфон отличен. И еще раз повторю ну очень он красив и симпатичен)",29,"1","2024-05-27T17:45:39.685998Z",64,7.715,"positive","2024-05-27T17:45:39.685998Z"
"Брал евротест за 18500 чёрный 32 гига. В комплекте наушники LG quadbeat 2 с гарнитурой нормального качества(сравнивал с sennheiser CX 300ii). Сборка на отлично. Курьер из магазина(Андрей) показал как пользоваться ,,купольной панорамой,, в камере-никогда бы не подумал что в такое возможно в телефоне!
            Вообще телефон вызывает восторженные впечатления, особенно при переходе с HTC Wildfire S",30,"1","2024-05-27T17:45:50.620288Z",65,7.684,"positive","2024-05-27T17:45:50.620288Z"
"Хотелось бы более умного энергосбержения или 8000 мА

Хотелось  исправить  ускоренную зарядку.
Разогревал  процессор до 55-59 градусов при максимальных нагрузках в руке было жарковато.

 Игрушки: 
Вначале не хотел запускать Hitman Sniper.Сбрасывал. 
С раза 5-го , о чудо-он запустился. 
Я мог играться в это чудо периодически).
Вайбер  из спящего режима может прислать уведомление, а клиент ВК ( Катэ мобайл) не хочет.",31,"1","2024-05-27T17:45:58.481619Z",66,5.226,"neutral","2024-05-27T17:45:58.481619Z"
"Телефон отличный) всем советую особенно в золотом круто смотрится",32,"1","2024-05-27T17:46:05.723625Z",67,4.834,"positive","2024-05-27T17:46:05.723625Z"
"Пользовался айфоном четыре года ,отличный телефон , не жалуюсь )). LG никогда не воспринимал как телефон , но когда этот аппарат попал мне в руки , я полностью пересмотрел свое мнение. Супер цена-качество !",33,"1","2024-05-27T17:46:14.593371Z",68,5.592,"positive","2024-05-27T17:46:14.593371Z"
"Смартфон понравился, подробности написал выше.Вот что касаемо перезагрузок, у меня их не было с ""коробки"". Дело в том, что нужно обновить смартфон до последней версии Android, в ней эту ошибку исправили. Всё-таки перезагрузки вызваны программным сбоем. Многие написали на форуме 4пда, что им помогло обновление. Так что, пробуйте. Сам же проблем никаких с аппаратом не испытываю. Все устраивает.",34,"1","2024-05-27T17:46:27.357750Z",69,10.484,"neutral","2024-05-27T17:46:27.357750Z"
"Пользуюсь телефоном более 2-х лет, телефон как ""пластилин"",т.е. тот кто заморачиваеться программами, прошивками и играми телефон для вас! Ставил множество прошивок и вернулся к родной и самой стабильной 2.3.Игрушки тянет на раз-два, аккумулятор стандартный для смартфона нового поколения.Удивляюсь отзывам о камере))) люди не путайте телефон с цифровой камерой!!!!! Быстрый отклик экрана, ""глотает"" всё, его не напугать замороченными программами и тяжёлыми играми.Одна беда - зависает, но при эксплуатации на все 100% в режиме non-stop!)))",35,"1","2024-05-27T17:46:36.681933Z",70,6.82,"positive","2024-05-27T17:46:36.681933Z"
"Великолепный телефон,есть абсолютно все за 10 тысяч рублей!!!а hdmi отдельный кайф можно взять с собой куда угодно и подключить к ноуту или телеку( он в комплекте)не слушайте всех подряд кто говорит лыжи отстой,я тоже честно говоря  попал под такое мнение  но друг купил я попользовался и понял что все сделано с умом.А стоит столько сколько должно стоить.",36,"1","2024-05-27T17:46:44.416556Z",71,4.62,"positive","2024-05-27T17:46:44.417567Z"
"ХТЦ сами себе копают яму.",37,"1","2024-05-27T17:46:53.746468Z",72,7.234,"negative","2024-05-27T17:46:53.747456Z"
"Взял из-за бренда. Долгое время пользуюсь Sony Ericsson. Но за 260уе хотелось бы более уверенную работу двух симкарт. Камера не удивила совершенно. У SE K850i те же 5мп были гораздо внушительнее.",38,"1","2024-05-27T17:47:08.107521Z",73,11.766,"neutral","2024-05-27T17:47:08.107521Z"
"На Windows Phone перешел не сразу. Сначала были комуникаторы на Windows Mobile и Windows CE. Но систему не развивали и я перешел на Apple.  Нам с IPhone было хорошо. Но закрытость системы утомила,  перебрался на андроид. Хорошая система, но то батарею разрядит неожиданно,  то слетит что нибудь, то настройки собьются и конечно перезагрузки без причин. Решился, купил Lumia 535.  Через неделю все настроил под себя, так все и работает. Все-же логика Windows легче воспринимается,  она такая как и на работе , как и дома в ноуте. Как действовать с разными программами, где искать файлы и как слушать музыку папками, сразу после загрузки. Не вызывает трудностей. Использовать новый 640XL оказалось удобно в руке держится отлично! Оптика камеры хороша! Фото отличные. Батарея держит отлично. Греется не сильно,  привык уже за два дня. Переехал быстро, все приложения установились без проблем. Прогресс в играх сохранился! И фото и видео на месте. Цена в 12 000 приемлема. С каждым днем Microsoft телефонов вокруг меня все больше и больше. Это заметно. Удобство использования, интуитивно понятная система. Я доволен. Всем советую!",39,"1","2024-05-27T17:47:22.055436Z",74,11.759,"positive","2024-05-27T17:47:22.055436Z"
"Стоит брать, свои деньги отрабатывает.опять же оговорюсь что телефон людям БЕЗпантов",40,"1","2024-05-27T17:47:30.193967Z",75,5.228,"positive","2024-05-27T17:47:30.193967Z"
"Все таки Сони делает качественно",41,"1","2024-05-27T17:47:41.080980Z",76,8.966,"neutral","2024-05-27T17:47:41.080980Z"
"После голого Android'a оболочка EMUI кажется непонятной, но это дело привычки.Как оказалось, челка это не совсем фу, тк её можно скрыть и получается очень даже удобно.Я в целом доволен обновкой.",42,"1","2024-05-27T17:47:51.041307Z",77,8.101,"positive","2024-05-27T17:47:51.041307Z"
"Шикарный дизайн. По железу никаких претензий, 8 ядер в паре с гигом оперативки работают без тормозов. Очень доволен звучанием динамиков. Две камеры 13 и 5 МП делают достаточно четкие снимки. Радует их расположение на передней части корпуса - когда смотришь видео, звук направлен на тебя! Из недостатков - отсутствие 4G. Но для меня наличие двух сим-карт критичнее. Для тех же, кому нужен LTE, есть версия на одну сим. Замечательный аппарат за свои деньги.",43,"1","2024-05-27T17:47:57.527883Z",78,4.362,"positive","2024-05-27T17:47:57.527883Z"
"Второй и последний раз, когда приобретаю устройство на базе WP.
 Добротный смартфон, отличный экран и хорошие внутренние характеристики напрочь испорчены одним огромным недостатком - он на операционной системе WP.
 Самое интересное, что полноценно пользоваться предустановленным офисом без наката 10 - у вас врядли получится. Более того, даже созданные на 8.1 файлики могут странным образом отказать в редактировании. После того, как вы обновите свой смартфон с 8.1 до 10 вы с удивлением обнаружите, что батарея стала заметно меньше держать заряд - даже без активного использования прожить смартфон на ""десятке"" больше суток без зарядки не сможет.
 Откровенная бедность магазина приложений. Да, есть куча наиболее популярных программ для соцсетей и... и всё. Найти какой-нибудь аналог андроидовскому MX Player (медиаплеер видеофайлов) так и не удалось и не удивлюсь, если не появится в ближайшие полгода-год. Иначе говоря кроме стандартных видеоформатов вы мало что сможете посмотреть на этом шикарном экране. Стандартный аудиоплеер - эквалайзер вы сможете отыскать в бог знает каком подменю специальных настроек. Если найдете вообще... Аналога офиса нет и не предвидится даже его появление (отсюда следствие - если вы хотели на смартфоне редактировать файлы офиса - обновитесь до десятки и скажите ""Good Bye"" долгоиграющей батарее.)
Если вам звонят во время прослушивания музыки в наушниках, то есть огромная вероятность, что смартфон уйдёт в не очевидную перезагрузку в ближайшую минуту.
 P.S. Не ведитесь на отзывы с оценкой ""5"" с отсутствующими недостатками и надписями, что ""ПРИЛОЖЕНИЯ ЕСТЬ!"". Это промытые культисты или, правильнее сказать, сектанты Windows Phone, которые в упор не видят и не хотят признавать ущербность и малочисленность приложений на этой ОС. Я честно старался отыскать годные и полезные приложения для воспроизведения видео и музыки - их нет. Даже тот же Steam вышел только буквально в августе этого года. Майкам наплевать на пользователей. Жду минусов обзора от сектантов.",44,"1","2024-05-27T17:48:28.362488Z",79,34.634,"neutral","2024-05-27T17:48:28.362488Z"
"Сначала написал плохой отзыв, но когда произвел сброс настроек - все заработало просто отлично. Поэтому пересмотрел оценку. Короче достойный аппарат - настоящий флагман.",45,"1","2024-05-27T17:48:37.931150Z",80,7.117,"positive","2024-05-27T17:48:37.931150Z"
"Был экран LG, начал зеленеть примерно через 2 недели. Позвонил на горячую линию, там сразу был пункт ""ДЛЯ ВЛАДЕЛЬЦЕВ МАТЕ 20 ПРО, ПРОБЛЕМА С ЗЕЛЕНЕЮЩИМ ЭКРАНОМ"". Там объяснили что нужно подъехать в ближайший сервис центр для замены экрана. Коробку и чеки не спрашивали, спросили только паспорт. заменили за 1.5 часа без каких либо следов.",46,"1","2024-05-27T17:48:52.931070Z",81,6.137,"negative","2024-05-27T17:48:52.931070Z"
"Очень непривычно после айфона, что не надо с собой носить розетку и удлинитель. При моём использовании, батареи хватает на 2-3 дня, что очень радует. Достаточно зарядить до 100% и 1 день можно не переживать даже при очень активном использовании. 

В целом, телефоном вполне доволен, учитывая что я его брал за 13000 + 1500 карта памяти на 32 гб. 
Рекомендую, если у вас уже есть микро юсб провод и для вас не критична комплектация. За эти деньги сложно найти что-то более достойное.",47,"1","2024-05-27T17:49:02.961450Z",82,7.868,"neutral","2024-05-27T17:49:02.961450Z"
"Если вы не поклонник Lenovo- просто подержите его в руках- вы не захотите с ним расстаться. Неизбитое решение по дизайну, очень громкий звук, огромнейший дисплей, камера 16 Мп. Отличное соотношение цена- качество, но частенько попадаются с проблемами с аккумулятором- тут уж как повезет.",48,"1","2024-05-27T17:49:10.817582Z",83,6.039,"positive","2024-05-27T17:49:10.817582Z"
"Телефон крут и денег своих стоит, я считаю. Две крутые камеры по 13 Мп, 32 гига встроенной памяти и 3 ОЗУ - о чем еще можно мечтать при такой цене?? Плюс много популярных фишек, типа поддержки 4ж, 5 версия Андроид и фирменная оболочка от Асус. Кстати, хорошо продуман интерфейс (разобрался за вечер во всех тонкостях)- тут разработчики ZenUI постарались.Пользоваться - одно удовольствие. А, и кстати, дизайн тут суперский! На фото этот смарт выглядит не так эффектно, как в жизни, когда держишь его в руках. Лежит удобно - поверхность слегка шероховатая, не выскользнет даже, учитывая размер экрана в 5,5 дюймов. Четко продуман и интерфейс - тут разработчики ZenUI постарались.",49,"1","2024-05-27T17:49:18.633356Z",84,6.071,"positive","2024-05-27T17:49:18.633356Z"
"Один из самых доступных и технологичных ""подфлагманов"" на конец 2014. Почти никаких проблем с ним не испытывал.",50,"1","2024-05-27T17:49:27.093391Z",85,6.506,"positive","2024-05-27T17:49:27.093391Z"
"Хороший смартфон,читайте 4PDA всё написано.",51,"1","2024-05-27T17:49:35.192760Z",86,4.488,"positive","2024-05-27T17:49:35.192760Z"
"Отличный аппарат, как навигатор использовать одно удовольствие, несмотря на огромный экран, в руке лежит просто отлично. Модель новая, сложно найти чехол, защитную пленку и т.п. Рекомендую.",52,"1","2024-05-27T17:49:45.285181Z",87,6.878,"positive","2024-05-27T17:49:45.285181Z"
